{
  "$schema": "http://json-schema.org/draft-04/schema#",
  "title": "Transitland Onestop-Registry Operator",
  "type": "object",
  "required": ["name", "onestopId", "geometry"],
  "properties": {
    "onestopId": {
      "type": "string",
      "format": "operatorOnestopId"
    },
    "name": { "type": "string" },
    "tags": { "type": "object" },
    "geometry": { "type": "object" },
    "identifiers": {
      "type": "array",
      "uniqueItems": true,
      "minItems": 1,
      "items": {
        "type": "object",
        "required": ["identifier"],
        "properties": {
          "identifier": { "type": "string" }
        }
      }
    }
  }
}