{
  "onestopId": "o-9q9-ACTransit",
  "name": "Alameda-Contra Costa Transit District",
  "tags": {
    "us_national_transit_database_id": 9014,
    "website": "http://www.actransit.org",
    "timezone": "America/Los_Angeles"
  },
  "identifiers": [
    { "identifier": "AC Transit" }
  ],
  "geometry": {
    "type": "Polygon",
    "coordinates": [[
      [-122.4219466,37.7728291],
      [-122.2998181,37.5351863],
      [-122.1487153,37.3938421],
      [-122.1458932,37.3934467],
      [-121.9001573,37.4138609],
      [-121.8941378,37.4317001],
      [-121.91129,37.530161],
      [-122.251045,37.9667104],
      [-122.2533713,37.9682723],
      [-122.3028331,37.9915676],
      [-122.3038451,37.9917478],
      [-122.3485642,37.9966206],
      [-122.349579,37.996726],
      [-122.3545248,37.9931709],
      [-122.3867859,37.9288703],
      [-122.4219466,37.7728291]
    ]]
  }
}
